INITIALIZATION
CREATE TABLE Update_table_1(id int, t_name char, col1 int, col2 int);
SUCCESS
CREATE INDEX index_id on Update_table_1(id);
SUCCESS
INSERT INTO Update_table_1 VALUES (1,'N1',1,1);
SUCCESS
INSERT INTO Update_table_1 VALUES (2,'N2',1,1);
SUCCESS
INSERT INTO Update_table_1 VALUES (3,'N3',2,1);
SUCCESS

1. UPDATE A ROW
UPDATE Update_table_1 SET t_name='N01' WHERE id=1;
SUCCESS
SELECT * FROM Update_table_1;
1 | N01 | 1 | 1
2 | N2 | 1 | 1
3 | N3 | 2 | 1
ID | T_NAME | COL1 | COL2

2. UPDATE ROWS
UPDATE Update_table_1 SET col2=0 WHERE col1=1;
SUCCESS
SELECT * FROM Update_table_1;
1 | N01 | 1 | 0
2 | N2 | 1 | 0
3 | N3 | 2 | 1
ID | T_NAME | COL1 | COL2

3. UPDATE A INDEX COLUMN
UPDATE Update_table_1 SET id=4 WHERE t_name='N3';
SUCCESS
SELECT * FROM Update_table_1;
1 | N01 | 1 | 0
2 | N2 | 1 | 0
4 | N3 | 2 | 1
ID | T_NAME | COL1 | COL2

4. UPDATE WITHOUT CONDITIONS
UPDATE Update_table_1 SET col1=0;
SUCCESS
SELECT * FROM Update_table_1;
1 | N01 | 0 | 0
2 | N2 | 0 | 0
4 | N3 | 0 | 1
ID | T_NAME | COL1 | COL2

5. UPDATE WITH CONDITIONS
UPDATE Update_table_1 SET t_name='N02' WHERE col1=0 AND col2=0;
SUCCESS
SELECT * FROM Update_table_1;
1 | N02 | 0 | 0
2 | N02 | 0 | 0
4 | N3 | 0 | 1
ID | T_NAME | COL1 | COL2

6. UPDATE NON-EXISTENT TABLE
UPDATE Update_table_2 SET t_name='N01' WHERE id=1;
FAILURE

7. UPDATE NON-EXISTENT COLUMN
UPDATE Update_table_1 SET t_name_false='N01' WHERE id=1;
FAILURE

8. UPDATE WITH INVALID CONDITION
UPDATE Update_table_1 SET t_name='N01' WHERE id_false=1;
FAILURE

9. UPDATE IN VAIN
UPDATE Update_table_1 SET t_name='N01' WHERE id=100;
SUCCESS
SELECT * FROM Update_table_1;
1 | N02 | 0 | 0
2 | N02 | 0 | 0
4 | N3 | 0 | 1
ID | T_NAME | COL1 | COL2

10. UPDATE WITH INVALID VALUE
UPDATE Update_table_1 SET col1='N01' WHERE id=1;
FAILURE
UPDATE Update_select_t2 SET col1=(select max(Update_select_t1.col2) from Update_select_t1),col2=(select max(Update_select_t1.col1) from Update_select_t1) where id=7;
SELECT * FROM Update_select_t2;
UPDATE Update_select_t2 SET col1=(select Update_select_t1.col1 from Update_select_t1 where Update_select_t1.id=7),col2=(select Update_select_t1.col2 from Update_select_t1 where Update_select_t1.id=4) where id=8;
- FAILURE
+ SUCCESS
-- below are some requests executed before(partial) --
-- init data
CREATE TABLE Update_select_t1(id int, t_name char(10), col1 int, col2 int);
CREATE TABLE Update_select_t2(id int, t_name char(10), col1 int, col2 int);
insert into Update_select_t1 VALUES (9, 'LX', 7, 4);
insert into Update_select_t1 VALUES (3, 'WEWGUOPV', 7, 5);
insert into Update_select_t1 VALUES (9, '24VYGLB', 6, 3);
...
-- update a row
UPDATE Update_select_t1 SET t_name='LSHS6RMQ', col2=3 WHERE id=7;
SELECT * FROM Update_select_t1;
UPDATE Update_select_t1 SET col1=2, col2=(select Update_select_t2.col2 from Update_select_t2 where Update_select_t2.id=1) WHERE id=4;
SELECT * FROM Update_select_t1;
-- update rows
UPDATE Update_select_t1 SET col1=7, col2=8 WHERE col2=4;
SELECT * FROM Update_select_t1;
-- update without condition
UPDATE Update_select_t2 SET t_name=(select Update_select_t1.t_name from Update_select_t1 where Update_select_t1.id=6);
SELECT * FROM Update_select_t2;
UPDATE Update_select_t2 SET col1=8,col2=1;
SELECT * FROM Update_select_t2;
-- update in vain
UPDATE Update_select_t2 SET t_name='YPHQDT6HN',col1=137 where col1=109;